{
  "schema": "cairn.cli.v1",
  "ok": true,
  "command": "task.show",
  "data": {
    "task": {
      "task_id": "018f4e6e-5f2b-7c3e-9a4d-2f6e8b1c9d0b",
      "project_id": "018f4e6e-5f2b-7c3e-9a4d-2f6e8b1c9d0a",
      "title": "Ship immutable tasks",
      "latest_revision_number": 2,
      "created_at": "2026-07-20T00:00:00Z",
      "updated_at": "2026-07-20T00:01:00Z"
    },
    "revision": {
      "revision_id": "018f4e6e-5f2b-7c3e-9a4d-2f6e8b1c9d0c",
      "task_id": "018f4e6e-5f2b-7c3e-9a4d-2f6e8b1c9d0b",
      "revision_number": 1,
      "parent_revision_id": null,
      "goal_contract": {"schema_version":1,"goal":"Implement task revisions","included_scope":[],"excluded_scope":[],"acceptance_criteria":[],"constraints":[]},
      "goal_contract_fingerprint": "aaaaaaaaaaaaaaaaaaaaaaaaaaaaaaaaaaaaaaaaaaaaaaaaaaaaaaaaaaaaaaaa",
      "created_at": "2026-07-20T00:00:00Z"
    }
  }
}
